{
    "program": {
        "name": "Water Confidence",
        "slug": "water-confidence-beginner",
        "description": "Master the fundamentals of water safety and comfort in a supportive learning environment. This 12-week program transforms water anxiety into confidence through progressive skill-building, breath control mastery, and proven techniques. Ideal for adults who are new to swimming or returning after years away. You'll understand the physics of buoyancy, develop autonomous water skills, and build the foundation for future stroke development.",
        "level": "beginner_1",
        "duration_weeks": 12,
        "default_capacity": 10,
        "currency": "NGN",
        "price_amount": 150000,
        "billing_type": "one_time",
        "prep_materials": {
            "required_equipment": [
                "Swim goggles (anti-fog recommended)",
                "Swimsuit (form-fitting preferred)",
                "Swim cap (optional but recommended)"
            ],
            "optional_equipment": [
                "Fins (provided by academy, personal pair welcome)",
                "Pull buoy (for later weeks)",
                "Kickboard (provided)"
            ],
            "pre_program_reading": [
                {
                    "title": "Why Humans Float",
                    "description": "Learn the simple science behind floating before your first session",
                    "url": null
                },
                {
                    "title": "Breathing Basics for Swimming",
                    "description": "How your breathing changes in water",
                    "url": null
                }
            ],
            "safety_briefing": "All students complete a safety orientation covering pool rules, emergency procedures, and hand signals (thumbs up/down for comfort level) before Week 1."
        }
    },
    "curriculum": [
        {
            "week_number": 1,
            "theme": "Getting Comfortable in Water & Learning to Breathe",
            "objectives": "Learn why you float, practice controlled breathing with your face in the water, and master safe entry and exit. Goal: Feel comfortable putting your face underwater for 5+ seconds while breathing out slowly.",
            "lessons": [
                {
                    "title": "Introduction to Floating & Breathing",
                    "description": "Discover why your body naturally floats (you're lighter than water!). Learn to stay calm when your face goes underwater by practicing slow breathing - breathe in above water, breathe out underwater. This is the most important skill in swimming. We'll also practice safe ways to get in and out of the pool, and how to stand up from any position (your safety anchor). Start with simple exercises: blow bubbles at the surface, then put your face in the water and hum (this makes sure you're breathing out), then practice slow exhales through your nose. If you feel nervous, we'll use a pool noodle for extra support.",
                    "duration_minutes": 60,
                    "video_url": null,
                    "skills": [
                        "Breath Control",
                        "Buoyancy Awareness",
                        "Safe Entry/Exit",
                        "Rhythmic Breathing",
                        "Submerged Exhalation"
                    ]
                }
            ]
        },
        {
            "week_number": 2,
            "theme": "Learning to Float Face-Down & Stand Back Up",
            "objectives": "Float comfortably on your front and learn the critical skill of returning to a standing position safely.",
            "lessons": [
                {
                    "title": "Front Float & Recovery",
                    "description": "Learn to float face-down by understanding how your body naturally wants to float. Your lungs are like a life jacket - when they're full of air, you float better. Practice keeping your head in a natural position (not lifted up). Most importantly, learn the 'tuck and twist' recovery: pull your knees to your chest, turn your body, and push down with your hands to stand. This skill lets you always return to safety. We'll practice this many times until it feels automatic.",
                    "duration_minutes": 60,
                    "video_url": null,
                    "skills": [
                        "Front Float",
                        "Recovery to Standing",
                        "Head Position Control"
                    ]
                }
            ]
        },
        {
            "week_number": 3,
            "theme": "Floating on Your Back",
            "objectives": "Learn to float on your back while managing the dizzy feeling that can come from looking up at the ceiling.",
            "lessons": [
                {
                    "title": "Back Float & Body Awareness",
                    "description": "Master floating on your back by keeping your chest lifted and head back. If you look at your toes, your hips will drop - so look at the ceiling instead. Your chest (where your lungs are) helps you float, so keep it up. Practice two positions: 'starfish' with arms and legs spread wide for stability, and 'pencil' with body straight and streamlined. Use ceiling tiles or lights as visual reference points if you feel dizzy. This position is your rest position - you can breathe freely while floating on your back.",
                    "duration_minutes": 60,
                    "video_url": null,
                    "skills": [
                        "Back Float",
                        "Spatial Orientation",
                        "Core Stability"
                    ]
                }
            ]
        },
        {
            "week_number": 4,
            "theme": "Gliding Through Water",
            "objectives": "Learn to push off the wall and glide smoothly through the water. Goal: Glide 5 meters from wall push-off.",
            "lessons": [
                {
                    "title": "Streamline Position & Push-Off",
                    "description": "Learn why streamlined swimmers move faster and farther - it's all about reducing resistance in the water. Stack your hands overhead, squeeze your ears with your arms, and point your toes. Push off the wall horizontally (not upward) and feel yourself glide. The better your body position, the farther you'll glide. This 'streamline' shape is the foundation of efficient swimming - you'll use it in every stroke you learn.",
                    "duration_minutes": 60,
                    "video_url": null,
                    "skills": [
                        "Streamline Body Position",
                        "Wall Push-Off",
                        "Gliding"
                    ]
                }
            ]
        },
        {
            "week_number": 5,
            "theme": "Kicking for Movement",
            "objectives": "Develop steady leg kicks from your hips while staying horizontal in the water.",
            "lessons": [
                {
                    "title": "Flutter Kick Basics",
                    "description": "Your kick helps you move forward and keeps your body level in the water. The key: kick from your hips, not your knees. Keep your ankles relaxed and 'floppy' like flippers - stiff ankles won't move you forward. Practice with a kickboard first, then with your hands extended in front, then on your back. Aim for a steady rhythm with small, quick kicks. Don't worry about speed - focus on keeping your legs moving smoothly from the hips with loose ankles.",
                    "duration_minutes": 60,
                    "video_url": null,
                    "skills": [
                        "Flutter Kick",
                        "Hip-Driven Movement",
                        "Body Position Maintenance"
                    ]
                }
            ]
        },
        {
            "week_number": 6,
            "theme": "Using Your Arms to Pull Through Water",
            "objectives": "Learn how to use your arms to move forward efficiently. Goal: Swim 5 meters using arm pulls with a kickboard.",
            "lessons": [
                {
                    "title": "Freestyle Arm Motion Introduction",
                    "description": "Your hand acts like a paddle to move you forward. Enter your hand in the water thumb-first at shoulder width, reach forward, then bend your elbow (about 90 degrees) and pull the water toward your hips. Think of it like climbing a ladder in the water. The pull should go along the center of your body - not out wide. We'll practice with one arm at a time using a kickboard, so you can really feel how the pull works. The key is bending your elbow (keeping it higher than your hand) to get a strong pull.",
                    "duration_minutes": 60,
                    "video_url": null,
                    "skills": [
                        "Freestyle Catch",
                        "High Elbow Pull",
                        "Underwater Pull Path"
                    ]
                }
            ]
        },
        {
            "week_number": 7,
            "theme": "Breathing While Swimming",
            "objectives": "Learn to breathe to the side without stopping your movement, using body rotation instead of lifting your head.",
            "lessons": [
                {
                    "title": "Side Breathing Technique",